{
  "schema_version": "1.0.0",
  "phase": "TF-B2B",
  "dataset_classification": "GOVERNED_EVENT_EVIDENCE_NOT_TRAINING_DATA",
  "normalization_basis": [
    "ml/flood-risk/manifests/flood-event-registry.json",
    "ml/flood-risk/manifests/candidate-events.json",
    "ml/flood-risk/manifests/source-manifest.json",
    "ml/flood-risk/manifests/dromic-caloocan-2019-evidence-extraction.json",
    "ml/flood-risk/manifests/phase-3b3b-ulysses-2020-review.json",
    "ml/flood-risk/manifests/phase-3b3b-florita-2022-review.json",
    "ml/flood-risk/manifests/phase-3b3b-enteng-2024-review.json",
    "data/import/caloocan-barangay-reconciliation.json",
    "data/import/caloocan-current-psgc.json"
  ],
  "governance": {
    "system_checked": true,
    "human_approval_claimed": false,
    "training_dataset_created": false,
    "training_matrix_created": false,
    "tensorflow_training_performed": false,
    "four_class_labels_created": false,
    "negative_labels_created": false,
    "mgb_susceptibility_used_as_target": false,
    "rainfall_regression_used_as_flood_evidence": false,
    "target_horizon_status": "NOT_APPROVED",
    "training_authorization_status": "NOT_APPROVED"
  },
  "source_documents": [
    {
      "source_document_id": "ndrrmc-pedring-2011-sitrep-12", "event_id": "caloocan-flood-candidate-2011-09-27-pedring",
      "source_organization": "NDRRMC/OCD", "source_document_title": "NDRRMC SitRep No. 12 re Effects of Typhoon Pedring", "source_revision": "SitRep No. 12",
      "source_public_reference": "https://ndrrmc.gov.ph/attachments/article/1748/SitRep_No_12_re_Effects_of_Typhoon_PEDRING_as_of_30SEP2011_1800H.pdf",
      "source_publication_date": "2011-09-30", "source_time_text": "as of 30 September 2011, 6:00 PM", "source_timezone": null,
      "source_availability": "INDEXED_ONLY", "source_acquisition_date": null, "source_hash": null, "local_file": null,
      "revision_relationship": "DISCOVERY_ONLY", "related_document_id": null, "preferred_for_event_scope": false,
      "evidence_role": "DISCOVERY_EVENT_EVIDENCE", "notes": "Official indexed content only; the raw official attachment is not acquired."
    },
    {
      "source_document_id": "ndrrmc-gener-haikui-2012-sitrep-02", "event_id": "caloocan-flood-candidate-2012-08-07-gener-haikui",
      "source_organization": "NDRRMC/OCD", "source_document_title": "NDRRMC SitRep No. 2 re Southwest Monsoon enhanced by Tropical Storm Haikui/Gener", "source_revision": "SitRep No. 2",
      "source_public_reference": "https://ndrrmc.gov.ph/attachments/article/2051/SitRep_No_02_re_Effects_of_Southwest_Monsoon_Enhanced_by_Tropical_Storm_HAIKUI_as_of_7AUG2012_1700H.pdf",
      "source_publication_date": "2012-08-07", "source_time_text": "as of 07 August 2012, 5:00 PM", "source_timezone": null,
      "source_availability": "INDEXED_ONLY", "source_acquisition_date": null, "source_hash": null, "local_file": null,
      "revision_relationship": "INITIAL", "related_document_id": null, "preferred_for_event_scope": false,
      "evidence_role": "DISCOVERY_EVENT_EVIDENCE", "notes": "Road-table content is indexed; the official raw attachment remains externally inaccessible."
    },
    {
      "source_document_id": "ndrrmc-gener-haikui-2012-sitrep-03", "event_id": "caloocan-flood-candidate-2012-08-07-gener-haikui",
      "source_organization": "NDRRMC/OCD", "source_document_title": "NDRRMC SitRep No. 3 re Southwest Monsoon enhanced by Tropical Storm Haikui/Gener", "source_revision": "SitRep No. 3",
      "source_public_reference": "https://ndrrmc.gov.ph/attachments/article/2051/SitRep_No_03_re_Effects_of_Southwest_Monsoon_Enhanced_by_Tropical_Storm_HAIKUI_as_of_8AUG2012_0700H.pdf",
      "source_publication_date": "2012-08-08", "source_time_text": "as of 08 August 2012, 7:00 AM", "source_timezone": null,
      "source_availability": "INDEXED_ONLY", "source_acquisition_date": null, "source_hash": null, "local_file": null,
      "revision_relationship": "SUPPLEMENTS", "related_document_id": "ndrrmc-gener-haikui-2012-sitrep-02", "preferred_for_event_scope": false,
      "evidence_role": "DISCOVERY_EVENT_EVIDENCE", "notes": "A report revision from the same weather episode, not an independent event."
    },
    {
      "source_document_id": "dromic-caloocan-2019-report-01", "event_id": "caloocan-flood-candidate-2019-06-24",
      "source_organization": "DSWD DROMIC", "source_document_title": "DSWD DROMIC Report 1 on the Flooding Incident in Caloocan City", "source_revision": "Report 1",
      "source_public_reference": "https://dromic.dswd.gov.ph/wp-content/uploads/2019/06/DSWD-DROMIC-Report-1-on-the-Flooding-Incident-in-Caloocan-City-as-of-28-June-2019-6PM.docx",
      "source_publication_date": "2019-06-28", "source_time_text": "as of 28 June 2019, 6PM", "source_timezone": null,
      "source_availability": "ACQUIRED", "source_acquisition_date": "2026-09-09T07:29:55.3458782Z", "source_hash": "0b4bad93472ac428b29b4f8e71fee01903d604a1b8f78e7f940cb0330716939a",
      "local_file": "ml/flood-risk/data/raw/event-evidence/DSWD-DROMIC-Report-1-on-the-Flooding-Incident-in-Caloocan-City-as-of-28-June-2019-6PM.docx",
      "revision_relationship": "INITIAL", "related_document_id": null, "preferred_for_event_scope": false,
      "evidence_role": "PRIMARY_EVENT_EVIDENCE", "notes": "Acquired official source; report issue time is not flood onset."
    },
    {
      "source_document_id": "dromic-caloocan-2019-terminal-report", "event_id": "caloocan-flood-candidate-2019-06-24",
      "source_organization": "DSWD DROMIC", "source_document_title": "DSWD DROMIC Terminal Report on the Flooding Incident in Caloocan City", "source_revision": "Terminal Report",
      "source_public_reference": "https://dromic.dswd.gov.ph/wp-content/uploads/2019/06/DSWD-DROMIC-Terminal-Report-on-the-Flooding-Incident-in-Caloocan-City-08-Jul-2019-7PM.docx",
      "source_publication_date": "2019-07-08", "source_time_text": "08 July 2019, 7PM", "source_timezone": null,
      "source_availability": "ACQUIRED", "source_acquisition_date": "2026-09-09T07:29:55.9736939Z", "source_hash": "5504eee1dc2927a7f1bff1eaf00d9b46ac12b2f61eb88f4a69f6afbf66b8b5a7",
      "local_file": "ml/flood-risk/data/raw/event-evidence/DSWD-DROMIC-Terminal-Report-on-the-Flooding-Incident-in-Caloocan-City-08-Jul-2019-7PM.docx",
      "revision_relationship": "LATER_CUMULATIVE", "related_document_id": "dromic-caloocan-2019-report-01", "preferred_for_event_scope": true,
      "evidence_role": "PRIMARY_EVENT_EVIDENCE", "notes": "Preferred only for documented final event scope; it does not define event onset or a training window."
    },
    {
      "source_document_id": "ndrrmc-ulysses-2020-sitrep-04", "event_id": "caloocan-flood-candidate-2020-11-12-ulysses",
      "source_organization": "NDRRMC/OCD", "source_document_title": "NDRRMC Situational Report No. 04 for Typhoon Ulysses", "source_revision": "SitRep No. 04",
      "source_public_reference": "https://ndrrmc.gov.ph/attachments/article/4138/SitRep_no_4_re_TY_Ulysses_as_of_12NOV2020_2000H.pdf",
      "source_publication_date": "2020-11-12", "source_time_text": "as of 12 November 2020, 8:00 PM", "source_timezone": null,
      "source_availability": "INDEXED_ONLY", "source_acquisition_date": null, "source_hash": null, "local_file": null,
      "revision_relationship": "INITIAL", "related_document_id": null, "preferred_for_event_scope": false,
      "evidence_role": "DISCOVERY_EVENT_EVIDENCE", "notes": "Indexed official content names six Caloocan barangays; the raw attachment is not acquired."
    },
    {
      "source_document_id": "ndrrmc-ulysses-2020-sitrep-23", "event_id": "caloocan-flood-candidate-2020-11-12-ulysses",
      "source_organization": "NDRRMC/OCD", "source_document_title": "NDRRMC Situational Report No. 23 for Typhoon Ulysses", "source_revision": "SitRep No. 23",
      "source_public_reference": "https://ndrrmc.gov.ph/attachments/article/4138/SitRep_no_23_re_TY_Ulysses_as_of_03DEC2020.pdf",
      "source_publication_date": "2020-12-03", "source_time_text": "as of 03 December 2020", "source_timezone": null,
      "source_availability": "INDEXED_ONLY", "source_acquisition_date": null, "source_hash": null, "local_file": null,
      "revision_relationship": "SUPPLEMENTS", "related_document_id": "ndrrmc-ulysses-2020-sitrep-04", "preferred_for_event_scope": false,
      "evidence_role": "DISCOVERY_EVENT_EVIDENCE", "notes": "A later revision of the same event; it is not an independent weather event."
    },
    {
      "source_document_id": "dromic-ulysses-2020-report-03", "event_id": "caloocan-flood-candidate-2020-11-12-ulysses",
      "source_organization": "DSWD DROMIC", "source_document_title": "DSWD DROMIC Report 3 on Typhoon Ulysses", "source_revision": "Report 3",
      "source_public_reference": "https://dromic.dswd.gov.ph/wp-content/uploads/2020/11/DSWD-DROMIC-Report-3-on-Typhoon-ULYSSES-as-of-12-November-2020-6AM-1.docx",
      "source_publication_date": "2020-11-12", "source_time_text": "as of 12 November 2020, 6AM", "source_timezone": null,
      "source_availability": "ACQUIRED", "source_acquisition_date": "2026-09-09T16:47:09.213Z", "source_hash": "e0d6da37088f408853201ca9533132fc5366b5662e80bf35b1267de4aac054c3",
      "local_file": "ml/flood-risk/data/raw/event-evidence/DSWD-DROMIC-Report-3-on-Typhoon-ULYSSES-as-of-12-November-2020-6AM-1.docx",
      "revision_relationship": "INITIAL", "related_document_id": null, "preferred_for_event_scope": false,
      "evidence_role": "NON_CONFIRMING_ACQUIRED_SOURCE", "notes": "Acquired official report contains no Caloocan reference."
    },
    {
      "source_document_id": "dromic-ulysses-2020-report-04", "event_id": "caloocan-flood-candidate-2020-11-12-ulysses",
      "source_organization": "DSWD DROMIC", "source_document_title": "DSWD DROMIC Report 4 on Typhoon Ulysses", "source_revision": "Report 4",